{
  "MATLABClass": "testClasses.ChildObject",
  "JSClass": "ChildObject",
  "ReferenceIDProperty": "SessionID",
  "Properties": {
    "SessionID": {
      "Type": "double",
      "ReadOnly": true
    },
    "Name": {
      "Type": "string",
      "ReadOnly": true
    },
    "Value": {
      "Type": "double"
    },
    "Units": {
      "Type": "string"
    }
  }
}
